{
  "$schema": "https://json-schema.org/draft/2020-12/schema",
  "$id": "https://github.com/Domain-Connect/DnsProviders/schema/provider.schema.json",
  "title": "DNS provider registry entry",
  "description": "Facts about a Domain Connect DNS provider the Scanner cannot measure. One file per providerId at providers/<a>/<b>/<providerId>.json. Every boolean is tri-state: true, false, absent or null = unknown. Consumers ignore unknown keys.",
  "type": "object",
  "required": ["providerId", "name"],
  "properties": {
    "providerId": {
      "title": "Provider ID",
      "description": "The providerId of the DNS provider's settings response; determines the path.",
      "type": "string",
      "minLength": 1,
      "pattern": "^[^/\\\\]+$"
    },
    "name": { "title": "Name", "description": "Display name.", "type": "string", "minLength": 1 },
    "url": { "title": "Website", "$ref": "#/$defs/url" },
    "exampleDomain": {
      "title": "Example domain",
      "description": "A domain that completes the whole discovery flow at this provider: its _domainconnect TXT record names the provider's API and the settings response there has this providerId. Only a domain of the provider itself or one the provider lists publicly; never a customer's domain.",
      "type": "string",
      "pattern": "^(?=.{1,253}$)([A-Za-z0-9]([A-Za-z0-9-]{0,61}[A-Za-z0-9])?\\.)+[A-Za-z0-9-]{2,63}$"
    },
    "logo": {
      "title": "Logo",
      "description": "The provider's logo: the address of the image, or the image embedded in the entry.",
      "oneOf": [
        {
          "title": "Logo URL",
          "$ref": "#/$defs/url"
        },
        {
          "title": "Embedded logo",
          "type": "object",
          "properties": {
            "format": {
              "title": "Format",
              "enum": ["svg", "png", "jpg"]
            },
            "data": {
              "title": "Image",
              "description": "The image file, gzip-compressed and base64-encoded.",
              "type": "string",
              "contentEncoding": "base64",
              "contentMediaType": "application/gzip",
              "pattern": "^H4sI[A-Za-z0-9+/]*={0,2}$"
            }
          },
          "required": ["format", "data"]
        }
      ]
    },
    "documentation": {
      "title": "Documentation",
      "description": "Public Domain Connect documentation.",
      "type": "array",
      "items": {
        "title": "Document",
        "type": "object",
        "required": ["title", "url"],
        "properties": {
          "title": { "title": "Title", "type": "string", "minLength": 1 },
          "url": { "title": "URL", "$ref": "#/$defs/url" }
        }
      }
    },
    "contacts": {
      "title": "Contacts",
      "type": "object",
      "properties": {
        "technical": {
          "title": "Technical contacts",
          "$ref": "#/$defs/contacts"
        }
      }
    },
    "onboarding": {
      "title": "Onboarding",
      "type": "object",
      "properties": {
        "mode": {
          "title": "Mode",
          "description": "automatic: templates merged into the Templates repository are deployed without a request. on-request: service providers request onboarding through the onboarding contacts. other: described in the mode description.",
          "enum": ["automatic", "on-request", "other"]
        },
        "updateSchedule": {
          "title": "Update schedule",
          "description": "When templates merged into the Templates repository are deployed, for example daily. Only with mode automatic.",
          "type": "string",
          "minLength": 1
        },
        "contacts": {
          "title": "Onboarding contacts",
          "description": "Where service providers request onboarding. Required, with at least one contact, with mode on-request; not allowed otherwise.",
          "$ref": "#/$defs/contacts",
          "minItems": 1
        },
        "modeDescription": {
          "title": "Description",
          "description": "How onboarding works. Only with mode other.",
          "type": "string",
          "minLength": 1
        },
        "documentationUrl": {
          "title": "Process documentation",
          "$ref": "#/$defs/url"
        },
        "cost": {
          "title": "Charged",
          "description": "Onboarding is charged.",
          "$ref": "#/$defs/flag"
        },
        "costDetails": {
          "title": "Details",
          "description": "What is charged and how. Only when charged is true.",
          "type": "string",
          "minLength": 1
        },
        "agreementRequired": {
          "title": "Contract, agreement or T&C acceptance required",
          "description": "A contract or agreement has to be signed, or terms and conditions accepted, before onboarding.",
          "$ref": "#/$defs/flag"
        },
        "agreementUrl": {
          "title": "Agreement URL",
          "description": "The agreement template, or the flow in which it is signed or accepted. Only when an agreement is required.",
          "$ref": "#/$defs/url"
        },
        "usesPartner": {
          "title": "Uses a partner",
          "description": "Onboarding runs through a third party.",
          "$ref": "#/$defs/flag"
        },
        "partners": {
          "title": "Onboarding partners",
          "description": "Third parties onboarding runs through. Only when uses a partner is true.",
          "type": "array",
          "items": { "$ref": "#/$defs/partner" }
        },
        "requirements": {
          "title": "Requirements",
          "type": "object",
          "properties": {
            "signedTemplatesOnly": {
              "title": "Signed templates only",
              "$ref": "#/$defs/flag"
            },
            "warnPhishingRejected": {
              "title": "warnPhishing rejected",
              "description": "Templates with warnPhishing are not accepted.",
              "$ref": "#/$defs/flag"
            },
            "signingKeyPublished": {
              "title": "Signing key published",
              "$ref": "#/$defs/flag"
            }
          }
        },
        "notes": {
          "title": "Notes",
          "description": "Further requirements or restrictions, verbatim.",
          "type": "string"
        }
      },
      "allOf": [
        {
          "if": { "properties": { "mode": { "const": "automatic" } }, "required": ["mode"] },
          "else": { "properties": { "updateSchedule": false } }
        },
        {
          "if": { "properties": { "mode": { "const": "on-request" } }, "required": ["mode"] },
          "then": { "required": ["contacts"] },
          "else": { "properties": { "contacts": false } }
        },
        {
          "if": { "properties": { "mode": { "const": "other" } }, "required": ["mode"] },
          "else": { "properties": { "modeDescription": false } }
        },
        {
          "if": { "properties": { "cost": { "const": true } }, "required": ["cost"] },
          "else": { "properties": { "costDetails": false } }
        },
        {
          "if": { "properties": { "agreementRequired": { "const": true } }, "required": ["agreementRequired"] },
          "else": { "properties": { "agreementUrl": false } }
        },
        {
          "if": { "properties": { "usesPartner": { "const": true } }, "required": ["usesPartner"] },
          "else": { "properties": { "partners": false } }
        }
      ]
    },
    "features": {
      "title": "Features",
      "type": "object",
      "properties": {
        "syncFlow": {
          "title": "Synchronous flow",
          "$ref": "#/$defs/flag"
        },
        "syncRedirectUri": {
          "title": "redirect_uri in the synchronous flow",
          "description": "redirect_uri honoured in the synchronous flow.",
          "$ref": "#/$defs/flag"
        },
        "asyncFlow": {
          "title": "Asynchronous flow",
          "description": "The flow based on OAuth.",
          "$ref": "#/$defs/flag"
        },
        "asyncRevert": {
          "title": "Revert in the asynchronous flow",
          "$ref": "#/$defs/flag"
        },
        "templateStateTracking": {
          "title": "Template state tracking",
          "description": "Applied templates are tracked.",
          "$ref": "#/$defs/flag"
        },
        "templates": {
          "title": "Template features",
          "type": "object",
          "properties": {
            "txtConflictMatching": {
              "title": "TXT conflict matching",
              "description": "txtConflictMatchingMode / txtConflictMatchingPrefix.",
              "$ref": "#/$defs/flag"
            },
            "variablesInNumberFields": {
              "title": "Variables in number fields",
              "description": "Variables in TTL, priority, weight, port.",
              "$ref": "#/$defs/flag"
            },
            "multiInstance": {
              "title": "Multiple instances",
              "description": "multiInstance.",
              "$ref": "#/$defs/flag"
            },
            "sharedNames": {
              "title": "Shared names",
              "description": "sharedProviderName / sharedServiceName.",
              "$ref": "#/$defs/flag"
            },
            "essential": {
              "title": "Essential records",
              "description": "Record attribute essential.",
              "$ref": "#/$defs/flag"
            }
          }
        },
        "recordTypes": {
          "title": "Record types",
          "type": "object",
          "properties": {
            "spfm": { "title": "SPFM", "$ref": "#/$defs/flag" },
            "custom": {
              "title": "Custom record types",
              "$ref": "#/$defs/flag"
            },
            "apexCname": {
              "title": "APEXCNAME",
              "$ref": "#/$defs/flag"
            },
            "redir301": { "title": "REDIR301", "$ref": "#/$defs/flag" },
            "redir302": { "title": "REDIR302", "$ref": "#/$defs/flag" }
          }
        },
        "settings": {
          "title": "Settings response",
          "description": "Optional properties of the settings response. The values are per domain; only whether the provider returns them is recorded.",
          "type": "object",
          "properties": {
            "urlControlPanel": {
              "title": "Control panel URL",
              "description": "urlControlPanel is returned.",
              "$ref": "#/$defs/flag"
            },
            "nameServers": {
              "title": "Name servers",
              "description": "nameServers is returned.",
              "$ref": "#/$defs/flag"
            },
            "windowSize": {
              "title": "Window size",
              "description": "width and height of the consent window are returned.",
              "$ref": "#/$defs/flag"
            },
            "nonStandard": {
              "title": "Non-standard properties",
              "description": "Properties returned that the specification does not define. Empty list = none.",
              "type": "array",
              "items": {
                "title": "Property",
                "type": "object",
                "required": ["key"],
                "properties": {
                  "key": {
                    "title": "Name",
                    "type": "string",
                    "minLength": 1
                  },
                  "description": { "title": "Description", "type": "string" }
                }
              }
            }
          }
        },
        "nonStandard": {
          "title": "Non-standard behaviour",
          "type": "object",
          "properties": {
            "cnameFlattening": {
              "title": "CNAME flattening",
              "description": "Templates with a CNAME on the apex can be applied without host parameter set. hostRequired is ignored in this case.",
              "$ref": "#/$defs/flag"
            }
          }
        }
      }
    },
    "notes": { "title": "Notes", "description": "Anything else, verbatim.", "type": "string" },
    "links": {
      "title": "Links",
      "description": "Generic list of links related to the entry. rel \"source\" marks a source the entry's data was taken from. A settings URL queried with a domain that neither belongs to the provider nor is listed publicly by it has the domain replaced by the placeholder {domain}.",
      "type": "array",
      "items": {
        "title": "Link",
        "type": "object",
        "required": ["url"],
        "properties": {
          "url": { "title": "URL", "$ref": "#/$defs/url" },
          "title": { "title": "Title", "type": "string", "minLength": 1 },
          "rel": {
            "title": "Relation",
            "description": "Relation of the link to the entry, e.g. \"source\". Consumers ignore values they do not know.",
            "type": "string",
            "pattern": "^[a-z][a-z0-9-]*$"
          },
          "accessed": {
            "title": "Accessed",
            "description": "Date the link was last checked, YYYY-MM-DD.",
            "type": "string",
            "format": "date",
            "pattern": "^\\d{4}-\\d{2}-\\d{2}$"
          }
        }
      }
    },
    "consent": {
      "title": "Consent to the submission terms",
      "description": "I accept the submission terms of this repository (TERMS.md): I may represent the DNS provider, the data matches its actual setup, the entry holds no personal data and every contact belongs to the organisation, I keep the entry up to date, domainconnect.org may use the data and logo on its website, and Domain Connect is not liable for the content. I dedicate the entry to the public domain under CC0 1.0 (LICENSE). Given by whoever submits the entry, on every submission; CI requires it in every added or changed entry.",
      "type": "boolean",
      "const": true
    }
  },
  "$defs": {
    "flag": { "type": ["boolean", "null"] },
    "url": { "type": "string", "format": "uri", "pattern": "^https?://[^\\s]+$" },
    "partner": {
      "title": "Partner",
      "type": "object",
      "required": ["name"],
      "properties": {
        "name": { "title": "Name", "type": "string", "minLength": 1 },
        "url": { "title": "Website", "$ref": "#/$defs/url" },
        "contacts": { "title": "Contacts", "$ref": "#/$defs/contacts" }
      }
    },
    "contacts": {
      "type": "array",
      "items": {
        "title": "Contact",
        "type": "object",
        "required": ["type", "value"],
        "properties": {
          "type": {
            "title": "Type",
            "description": "email: value is an e-mail address. url: value is a web page. form: value is the URL of an online request form. other: free text.",
            "enum": ["email", "url", "form", "other"]
          },
          "value": { "title": "Value", "type": "string", "minLength": 1 },
          "label": { 
            "title": "Label", 
            "type": "string", 
            "description": "Optional label or added information for the contact, e.g. to differentiate multiple inputs of same type." 
          }
        },
        "allOf": [
          {
            "if": { "properties": { "type": { "const": "email" } } },
            "then": { "properties": { "value": { "format": "email", "pattern": "^[^@\\s]+@[^@\\s]+$" } } }
          },
          {
            "if": { "properties": { "type": { "enum": ["url", "form"] } } },
            "then": { "properties": { "value": { "$ref": "#/$defs/url" } } }
          }
        ]
      }
    }
  }
}
