{
  "providerId": "manager.nuxoa.de",
  "name": "NUXOA",
  "url": "https://nuxoa.de",
  "features": {
    "syncFlow": true,
    "asyncFlow": false,
    "settings": {
      "urlControlPanel": true,
      "nameServers": false,
      "windowSize": false,
      "nonStandard": []
    }
  },
  "notes": "The settings response has no providerDisplayName. urlControlPanel contains the literal placeholder %domain%.",
  "links": [
    {
      "url": "https://manager.nuxoa.de/de/domainconnect/v2/nuxoa.de/settings",
      "title": "Settings response for nuxoa.de (providerId, no urlAsyncUX)",
      "rel": "source",
      "accessed": "2026-10-09"
    }
  ]
}
