{
  "providerId": "wordpress.com",
  "name": "WordPress.com",
  "url": "https://wordpress.com",
  "logo": {
    "format": "png",
    "data": "H4sIAAAAAAAAA43XdyMUjAMA4LNCkVXUS+jurLOPjDLCneOScc7KOJEte13IzhkXjrND9hZe6bLCXZyZnURZeTlbKPP3FX5/PZ/hSTA2RLBf/ecqAABg19eDoQAAujIAABDCwgAAAJzm7swCAIB0YwM0/PLy8suvPcqPrdi22ZCWaaXcfnECGZD0CRBOAkR8BES1AeI7AXEdgJh2QGzH83cTtpWjRPKC0dsht7pxrYKB5O7vgqm9T8qGH+f3v2iatK0de902G986Y1o4ENw2Cwh83zCyDAhpnVzZ6ftOy6MsVHxZ2T46Wdw56pzf/Lpx0DD+a//vWcvX9Z87R8WDS+uHJ0en5xHz4DoAgH1eH6aFDvm2le8Rmne/+RXFyj/Vc9n0pNNja6r0fWMj/u9llxdzqhTXOLHmwfN0D4vjClgk54FcyRiAN+qhMCcLI/3/QyEc3eByEG9GMuDr85DrEyt1R0rQEZ2d627otdSOdksVJi5fNeFp1n4IM04spGtJjnbTYD/Uhcprm4g+DlcTpNnmcgk3RpsJDB1I4PzstfuDZsxVRkxQkaKZc9ZyY33pSNHYFUg52ZpaWsSqe2Jfzw/GU/+G5q0RWAaUbm2AVCGiIZXk44Rr4CGdydOH7lRw8BLGLethrmG3pRAFzk2zbKfYcflbrr7kROi/8A8NbQW7OGgwxoQzWlDasXNH/lXZuABBqSOuFQObhFa9yCs+vAZHp/ppwrzeY/RWKyZnSt/it370FaXhwE9BC+DMFVfKztJZ5aoGDuwnerKj0LwKkbyYoJp7ms+tYmytP0o1Pw7aNqP/WILyXXv/xImqN+JJrEO8eumldzkK0e/RKoNY3x4I4GtZSim+AkThKm9ET2rj5kGRDnG2/KCfyy0WOgQGiJFTWaIvwKm8kQ+6udAwflORwzXOGLymOUSUotavM7odt4Er6Dq+39t7hkDZ0aeJR9f43DAAgxb1Un/+5kFrA5nuVOJuqfJGXH0pnO4yEyY/bHlqqFx0wXweniKXO2NIwPlIC+Ts1R3XxA5PKGSFN6X9Mv+jI37PSqz7jc/ul/7ZSZrwyG2+nnEojfSh2RhG/ts/4n7kj4727uFcM7DBacbyE9SeV8Zb9KRBQPOPLYGKj31jOtlETMeuDjL4D4Alf8wUXcxCEpRcJraEPgm6grhLBa3w+wevF2CZq0UCMGYw9rADUbBtHjcyw8KP8W4/hxFtKn+R/ih8dbdJ4jFOecLC/FhngZ1ZvmEpqhEb3h1I5yxv2r5fUfZ9qy1v2JlKyaOrUak/kabNSuG3cjZ+Y1sdH5hRG+V97yWelny74Ax9YMM/ETXaYnjSjIkDfVPfyZZZitnN2fwC6/GlnegH25ny951H+LYu0oYFP4ZozAO5d66QHnU1VQEd6ioRC3avtCTIhut1mvHrqFuZQ2UfAG6hs8zCRFzUHX10+GfNhtjnoWFn3q23Nt73H9rHkWbZp4vP65HW6ozfDC5MWU0cg/uX5b5ODBSI7eXLZrk+SSLnv+zmNmMeCJtJlGDXF3jf+60cURb7trC4k3aUMhT3NW8w/cCfb10ZFdgP5N1ZZhyq42Q3zNKyyFu9Z5dX6uJ3F1iE9yjweD+Fey/cQjO41jLIu6jyH5GhmR5AKd2e40crcL0VjROX7S2aTPUH6Yj+lCYK3gKmIZ1hU8o4XXdzAM4gVcjTJrOXquX2fv3plaGrpwpc6dk+/ZF6oGKHV5+PShK4TmsiiWb6fmPlKNDvLct8OL3tTGW2pR25TUV7R5M5TGTFSW1YYt+rQrY4nc422TVVGGp4/VzADDra4VbVOo+dYNckkftEGTo5OrTUNUHLoucfZSR5LHybcSXLQMR3r5BqQlJpDNIXdHswMF0mXiyX/CIo4fXj16V+xz7lD7AB35/rX59RpCkp94l3gnMIE3HBbSalZqSaLlFJ6VFdMFAqz9GmopRFoYa7ilEOI7D8aAD24fujcqs7QsGq3MtW7fFxKAV/DOFx0Zutirve5a67BHaq2A+Kjy+m2+vE0apV1/IX81gjPDrHrV3cuXbTrYm0T8i42VZ9Sq8Y0Zc1oqcmhEax1pyB2W5CveuPtaGi5hO1LfHTjfLSoj0+1kbSqogeM6fvG/8Rqr8GKCCiJ6thA5/JkvLyNVPDv4vv09rj0VW23vdKWOzUg2fUWLHXnHi7RHpXWxIkXIjXF7kd0n1vceCjJlGWQGGZOmTp3X1/ZduTOHwVMkjcmAOShsrhY73Zlu9XFr9XkHO34Aq3+2UHW12zW9kVo4t/YAXbEGmESJS2JQ4rstBLwF/pn0hVnklPbUU49sgmn6YlRZFS8Pf5rdPqug3oJZ3nX9OQYjXcm4gJdvQFAVtN6GhInK4kBxytmWpeKl7O3+ieKI2mUrqqFF163PftPymPvT1wKSFoMn2qdFUwHdpBs8pcADOVG6Q9JTEilaHEjHtxw5xARz83oFD6euzYCRrCJvq9dvhuCZKpceH1lb1cZMVtaE7OVlTf9uvS9p9m2dvZWAlR0WC6p8hrutF7riuzrYUOGhwWyz+GVEnz+SYLDSi2ZzPawVdzn2E9BHRFxtOQynB39cm85AQQTZuJfbWk5BD6aCQ/x+MWke6NpCUmALLn2Wgn1uzHkKgnE2umf+eMMPOlIW/VT+HBp021zKicQFAn4jdy+JnjFfWP6sPqxz9Mllr2gl+0Ii1TwCbXIjIY8v+OtClGJHvmcPCYhiq7WcvVx3Pi8G90vXqWkxygkG63F/OZ/RYJtwpNcvV0fANEqpgXvwwN0qh+0jmkLW+wKGWbYpvHtlTuRqkJg5sm+/47wMTIZ4dHhmJEZCJykTI+JPjm5wMvZ9D8VBUdQsFFS1q3mS13PyRwRkHIhu6k5LLJNMv/EapVS2SL2tpMEcvSPIFUPbWCDH6TFNgg+egBM6+Xa4n4QiKtqGZbCeORQG3Lzz2LHMYPhA5N7yI8xslzKiHOF6kLDajoaZMGPfV6oEURdmCFmxrzb+CUZz6U8pDzuOfXwpdqu1rtW8RdCvBTNTngCO2XFvGkb1m2jeIwZlNsriK4+W3oelpILKpO/gEdD4PYyNEUd6pet/Plk4tBilWyyt1Fwz96qIhzP+JR5doyXKp+51X8hDY+y+SeZbyLIDyG4Ziu3ie+MLBQg7fW2bsmIESnzO21shl1a3R2XxMU+3bepQiXdi7RclkUK5ei0YDkMl6EpqUBqyDkQ7ihvMvtuUSWN5js6hsWbo9kldI+HJVEgJbw6CdFVrr8Xpr1BIWVDNNEPamJvfjAIozEMrj/TBW4QGc5P1ToLrCfgayNmX37JudaqMOIXciV9D+JSsLXp2Vh7M9OMD89ZnvRZSfwI58TLSJj+97QXv4Atc294iZnr1Wy6xAu/EZNl50zRxKmDiVU4rlzYNKf5CRmwd4ZM1XETXOFhJMMs4jDgDqe/gEDtNcvaDZhWBKiTtKuU91mRjdZ7ebRxTYnLHMqyj7imd6fWI3pMjqjmSEzckkKLxJLszkO8Mdh79ot/JTKR7aEP993jKhUdbRtmjqsxYI336bcNCVeJ7sr+Y0LGVO/nZ5Mw42S6P6SmTjG72HfDPaGbI/HYxpQbMnLFneGNso+xa3Zu8szqjUVLFerb69Tau3V/vAYzfgFF0krtF6YR/dXrVjijwf/MJslenbsntpEtnCm7+WVhHkHDzrN/H2B3psq+3MISehhykaTUvn0sXfQAdfmQPYOfDojcjKJfMurTow2nAezFFg+KfK1TqEp0V3Y4Nwo6KWxSJob4ZCfluJmPDRr9/1F3r9BYHeZz7WKNQMRlIefu3TKGFX9gzYlTiJdnlzLWi27aig69o60kMQc6y6mlp0TsI7hLj1C/4JLVxAcexnfF4Kgl5VIMXuCHavT7OHCCGgmujfcx8C7wGNurxTVG2NiyCO1M6/B/oaHT0w+lX7R/Ow6ESLHmmJamgRj2syPyUlF5Bttw5kbBznq+vABHv5wy82C6g0oM9DtvQE6Eczz7LDl/tYj4xr2yyKkg+xpHz5QYKYNS5fSgWSBPyn0at1ogglyjyaRPX1rvVonNHRQksd0iRKv0LmsEiRYX/hH7Jn7Axcbu2rIkxt6NvkRjcj62jxSzkcGHq6Y2jBmGmMigC9oChC66JN7o2cN9/kp2xpb9g09VoN/eB2KCXlKOBPkQzy2bUqzmvC1BAg1Gk1IRtomwTI+1coJFksoRKPF027vH9iKNNWkVxqT3UPyeDtz9+gVYjKKcHc1cT9KUCKsub7ESrnbBXcCmdHXnPwqSEv4bGPNaIO40dsPi3dn5YU96jjNxzq2THq0klWcil7NO9fprTgqJG9zCWJMJdKbbjhWq/5Wf6ctNV0MmorU4XloxV4uTWe8fgGDcL2SbhqYX7q6aSwX5F0RgJCPtmtrNf3ZyBu8P5Yqk7KbEiJb5dCOr4ZBv9mD7FS+OpRBH7ztNTFw7VIPb0vgMhrFyfs2SbVicms8SOGhieRHxYFd1jOYwzradP5P4XK18NOgXMWFjWdWmYPPIn5M6ibJhptu6WI/1HZ5Du4P3veyta5qHmib2nhJplmq1A9n1YPmFO9Y/17hWN9tN2nn/6ipssBw+Mxc+biOiU9NPNjRfG5XfcxbrHOtk/nX+mC/pGAui5foWNnu+QFzKj31DUZkv5nBWgTqne55k7rLtBr/TpuAr+HOAff5HP0QyQV137+1qbycCfV7rskFGrdebFRUhUvCEmIH7Rs4MljXjuFSkxMcYwES1QK9oyxhHwywimFURAivBvxHUJUVD2OaRoYqpw7Er5jq4aq/Y1/TqcHLdti4CebZ19lR6ulTsWy9dwb5L95/IOrVylPu66HEFejZq0UXewxA3XRow8OD8T5iOPPDhPi117/1XfPoc/Terpwt7nRdvvwqnpBrpRXEOv0XJrDGnZqT8ACnL5ng9ieOaoTIz4jL+HLXqdE2FhN2WZtvtLfql2B09+n/Ga6HwruXqZdMmhf60VjFD/4AAACgDzeE1WvbR/8PiFl7SLUOAAA="
  },
  "onboarding": {
    "mode": "on-request",
    "contacts": [{ "type": "email", "value": "registrar@automattic.com" }]
  },
  "features": {
    "syncFlow": true,
    "asyncFlow": false,
    "settings": { "urlControlPanel": false, "nameServers": false, "windowSize": true, "nonStandard": [] }
  },
  "notes": "Domains on WordPress.com name servers carry the TXT record _domainconnect = public-api.wordpress.com/rest/v1.3/domain-connect by default; the domain owner can delete it. The settings response points urlAsyncUX at an \"unsupported\" endpoint.",
  "links": [
    {
      "url": "https://www.domainconnect.org/dns-providers/",
      "title": "Domain Connect: DNS Providers (onboarding contact, logo)",
      "rel": "source",
      "accessed": "2026-10-09"
    },
    {
      "url": "https://wordpress.com/support/domains/custom-dns/view-or-restore-default-dns-records/",
      "title": "WordPress.com Support: Restore default DNS records (_domainconnect discovery record)",
      "rel": "source",
      "accessed": "2026-10-09"
    },
    {
      "url": "https://public-api.wordpress.com/rest/v1.3/domain-connect/v2/jetpack.com/settings",
      "title": "Settings response for a WordPress.com-hosted domain (providerId, async flow unsupported)",
      "rel": "source",
      "accessed": "2026-10-09"
    }
  ]
}
