{
  "providerId": "godaddy.com",
  "name": "GoDaddy",
  "url": "https://www.godaddy.com",
  "logo": "godaddy.com.png",
  "onboarding": {
    "mode": "on-request",
    "contacts": [{ "type": "email", "value": "domainconnect@godaddy.com" }],
    "notes": ""
  },
  "features": {
    "syncFlow": true,
    "asyncFlow": true,
    "settings": { "urlControlPanel": true, "nameServers": true, "windowSize": false, "nonStandard": [] }
  },
  "notes": "GoDaddy-hosted domains point _domainconnect (CNAME) to _domainconnect.gd.domaincontrol.com.",
  "links": [
    {
      "url": "https://www.domainconnect.org/dns-providers/",
      "title": "Domain Connect: DNS Providers (onboarding contact, logo)",
      "rel": "source",
      "accessed": "2026-10-09"
    },
    {
      "url": "https://domainconnect.api.godaddy.com/v2/{domain}/settings",
      "title": "Settings response for a GoDaddy-hosted domain (providerId, sync and async flow URLs)",
      "rel": "source",
      "accessed": "2026-10-09"
    }
  ]
}
